#AuthorIDs,Title,Content
1;Bobo je smutny;Lorem ipsum dolor sit amet, consectetur adipiscing elit, sed do eiusmod tempor incididunt ut labore et dolore magna aliqua. #FreeHK Viverra suspendisse potenti nullam ac tortor vitae purus. Sagittis id consectetur purus ut faucibus pulvinar elementum. Enim diam vulputate ut pharetra sit amet aliquam id. Pretium nibh ipsum consequat nisl vel pretium. Tempus egestas sed sed risus pretium quam. Mauris pharetra et ultrices neque. Ullamcorper eget nulla facilisi etiam dignissim. Id interdum velit laoreet id donec ultrices. Volutpat diam ut venenatis tellus in. Purus sit amet luctus venenatis lectus magna fringilla urna porttitor. Velit sed ullamcorper morbi tincidunt ornare massa eget. Consectetur adipiscing elit ut aliquam purus sit. Aliquam ut porttitor leo a diam sollicitudin. Amet cursus sit amet dictum. Nisl nisi scelerisque eu ultrices vitae. Malesuada bibendum arcu vitae elementum curabitur. Tellus rutrum tellus pellentesque eu tincidunt tortor aliquam nulla facilisi. Vel risus commodo viverra maecenas accumsan lacus.Purus faucibus ornare suspendisse sed nisi lacus sed. Congue nisi vitae suscipit tellus mauris a. Ac turpis egestas sed tempus urna et pharetra pharetra. Ipsum a arcu cursus vitae congue mauris. Tellus in metus vulputate eu scelerisque felis imperdiet. Massa vitae tortor condimentum lacinia quis vel eros. Purus faucibus ornare suspendisse sed. Eu scelerisque felis imperdiet proin fermentum leo. Varius sit amet mattis vulputate. Tempor id eu nisl nunc mi ipsum faucibus vitae aliquet. Lacus sed viverra tellus in hac habitasse. Felis imperdiet proin fermentum leo. Enim blandit volutpat maecenas volutpat blandit aliquam etiam. Urna molestie at elementum eu. Imperdiet proin fermentum leo vel. Eu scelerisque felis imperdiet proin fermentum. Morbi non arcu risus quis. Aliquam etiam erat velit scelerisque in dictum non consectetur. Maecenas ultricies mi eget mauris.Cursus vitae congue mauris rhoncus aenean. Commodo viverra maecenas accumsan lacus vel. Amet tellus cras adipiscing enim. Purus in massa tempor nec feugiat nisl. Etiam dignissim diam quis enim lobortis. Nullam vehicula ipsum a arcu cursus vitae congue. Ut enim blandit volutpat maecenas volutpat blandit. Mi proin sed libero enim. Semper eget duis at tellus at urna condimentum. Praesent semper feugiat nibh sed. Pellentesque habitant morbi tristique senectus et netus. Volutpat consequat mauris nunc congue nisi vitae suscipit tellus. Convallis a cras semper auctor neque vitae tempus.Nulla facilisi morbi tempus iaculis urna id. Vitae aliquet nec ullamcorper sit. Et magnis dis parturient montes nascetur ridiculus. Sed elementum tempus egestas sed sed risus pretium quam vulputate. Faucibus scelerisque eleifend donec pretium vulputate sapien. Enim sit amet venenatis urna cursus eget nunc scelerisque. Auctor neque vitae tempus quam pellentesque nec. Amet luctus venenatis lectus magna fringilla. Nec sagittis aliquam malesuada bibendum arcu vitae elementum curabitur vitae. Amet dictum sit amet justo donec. Commodo viverra maecenas accumsan lacus vel facilisis volutpat est velit. Enim nulla aliquet porttitor lacus. Vitae proin sagittis nisl rhoncus mattis rhoncus. Fermentum dui faucibus in ornare quam viverra. Ut sem nulla pharetra diam sit. Facilisis gravida neque convallis a.At elementum eu facilisis sed odio. Cursus risus at ultrices mi tempus imperdiet nulla malesuada pellentesque. Posuere sollicitudin aliquam ultrices sagittis orci a scelerisque purus. Elit pellentesque habitant morbi tristique senectus et netus et. Orci porta non pulvinar neque laoreet suspendisse interdum. Elit ut aliquam purus sit amet. Bibendum enim facilisis gravida neque. Ipsum dolor sit amet consectetur adipiscing elit pellentesque habitant morbi. A condimentum vitae sapien pellentesque. Auctor augue mauris augue neque gravida. Lorem ipsum dolor sit amet consectetur adipiscing elit ut. Sapien et ligula ullamcorper malesuada proin libero nunc. Pellentesque pulvinar pellentesque habitant morbi tristique. Urna id volutpat lacus laoreet non curabitur gravida arcu ac. Tortor condimentum lacinia quis vel. Ullamcorper malesuada proin libero nunc consequat interdum varius sit amet. Semper quis lectus nulla at volutpat diam ut venenatis.
2;Samuso je smutny;Lorem ipsum dolor sit amet, consectetur adipiscing elit, sed do eiusmod tempor incididunt ut labore et dolore magna aliqua. #FreeHK Viverra suspendisse potenti nullam ac tortor vitae purus. Sagittis id consectetur purus ut faucibus pulvinar elementum. Enim diam vulputate ut pharetra sit amet aliquam id. Pretium nibh ipsum consequat nisl vel pretium. Tempus egestas sed sed risus pretium quam. Mauris pharetra et ultrices neque. Ullamcorper eget nulla facilisi etiam dignissim. Id interdum velit laoreet id donec ultrices. Volutpat diam ut venenatis tellus in. Purus sit amet luctus venenatis lectus magna fringilla urna porttitor. Velit sed ullamcorper morbi tincidunt ornare massa eget. Consectetur adipiscing elit ut aliquam purus sit. Aliquam ut porttitor leo a diam sollicitudin. Amet cursus sit amet dictum. Nisl nisi scelerisque eu ultrices vitae. Malesuada bibendum arcu vitae elementum curabitur. Tellus rutrum tellus pellentesque eu tincidunt tortor aliquam nulla facilisi. Vel risus commodo viverra maecenas accumsan lacus.Purus faucibus ornare suspendisse sed nisi lacus sed. Congue nisi vitae suscipit tellus mauris a. Ac turpis egestas sed tempus urna et pharetra pharetra. Ipsum a arcu cursus vitae congue mauris. Tellus in metus vulputate eu scelerisque felis imperdiet. Massa vitae tortor condimentum lacinia quis vel eros. Purus faucibus ornare suspendisse sed. Eu scelerisque felis imperdiet proin fermentum leo. Varius sit amet mattis vulputate. Tempor id eu nisl nunc mi ipsum faucibus vitae aliquet. Lacus sed viverra tellus in hac habitasse. Felis imperdiet proin fermentum leo. Enim blandit volutpat maecenas volutpat blandit aliquam etiam. Urna molestie at elementum eu. Imperdiet proin fermentum leo vel. Eu scelerisque felis imperdiet proin fermentum. Morbi non arcu risus quis. Aliquam etiam erat velit scelerisque in dictum non consectetur. Maecenas ultricies mi eget mauris.Cursus vitae congue mauris rhoncus aenean. Commodo viverra maecenas accumsan lacus vel. Amet tellus cras adipiscing enim. Purus in massa tempor nec feugiat nisl. Etiam dignissim diam quis enim lobortis. Nullam vehicula ipsum a arcu cursus vitae congue. Ut enim blandit volutpat maecenas volutpat blandit. Mi proin sed libero enim. Semper eget duis at tellus at urna condimentum. Praesent semper feugiat nibh sed. Pellentesque habitant morbi tristique senectus et netus. Volutpat consequat mauris nunc congue nisi vitae suscipit tellus. Convallis a cras semper auctor neque vitae tempus.Nulla facilisi morbi tempus iaculis urna id. Vitae aliquet nec ullamcorper sit. Et magnis dis parturient montes nascetur ridiculus. Sed elementum tempus egestas sed sed risus pretium quam vulputate. Faucibus scelerisque eleifend donec pretium vulputate sapien. Enim sit amet venenatis urna cursus eget nunc scelerisque. Auctor neque vitae tempus quam pellentesque nec. Amet luctus venenatis lectus magna fringilla. Nec sagittis aliquam malesuada bibendum arcu vitae elementum curabitur vitae. Amet dictum sit amet justo donec. Commodo viverra maecenas accumsan lacus vel facilisis volutpat est velit. Enim nulla aliquet porttitor lacus. Vitae proin sagittis nisl rhoncus mattis rhoncus. Fermentum dui faucibus in ornare quam viverra. Ut sem nulla pharetra diam sit. Facilisis gravida neque convallis a.At elementum eu facilisis sed odio. Cursus risus at ultrices mi tempus imperdiet nulla malesuada pellentesque. Posuere sollicitudin aliquam ultrices sagittis orci a scelerisque purus. Elit pellentesque habitant morbi tristique senectus et netus et. Orci porta non pulvinar neque laoreet suspendisse interdum. Elit ut aliquam purus sit amet. Bibendum enim facilisis gravida neque. Ipsum dolor sit amet consectetur adipiscing elit pellentesque habitant morbi. A condimentum vitae sapien pellentesque. Auctor augue mauris augue neque gravida. Lorem ipsum dolor sit amet consectetur adipiscing elit ut. Sapien et ligula ullamcorper malesuada proin libero nunc. Pellentesque pulvinar pellentesque habitant morbi tristique. Urna id volutpat lacus laoreet non curabitur gravida arcu ac. Tortor condimentum lacinia quis vel. Ullamcorper malesuada proin libero nunc consequat interdum varius sit amet. Semper quis lectus nulla at volutpat diam ut venenatis.
3;Concerns After Biden Refuses to Eat His Food;Democrat presidential candidate Joe Biden’s nurse is concerned for his health as he has refused to eat his mush for the fourth time this week. “After giving him his morning formaldehyde drip I tried to feed Joe, he just closed his mouth and grunted some words I did not understand, something about me being ‘full of shit!’ and Joe just put on an angry face, keeping his mouth shut,” Biden’s nurse, Janine Cotillero, told MSNBC. Biden’s campaign manager was also concerned for his candidate, and suggested they might have to feed Biden with a tube. “We need him on the podium at the rallies, just feed him, do what you gotta do, put the tube in his ass if you have to,” Miles Rundringer, Joe Biden’s 2020 campaign manager told his nurse, according to reports. Currently, Biden is leading the Democrat race to beat Donald Trump in November’s U.S. election. The Democrats who control the U.S. media, have forbidden anyone to reveal Biden’s true age, however at a recent visit to Redwood National Park in California, a reporter asked Biden how old he is, and he mumbled some incoherent gibberish before pointing at one of the trees, which can live for over 600 years.
1;Man Awakes From Woke Nightmare;The New Jersey man awoke from his woke nightmare yesterday evening whilst being preached at by another woke celebrity on twitter, the social network. “Everyone I know now is a control freak woke activist, everywhere I go to on the internet I am accosted by woke preachers telling everyone how to think and what to say,” the man said from his hiding place.    According to the man, he awoke from his woke nightmare and now appreciates life a lot more.    “Before, I was told that all white people are bad, all people who do not believe in socialism or communism are fascist evil killers, and that anyone who dared to eat meat might as well eat their own children.    “It was a nightmare, everything was racist, every man was a sexist pig who needed to be castrated, and the world was either black or white, there was no grey, there was nothing but socialist labels put on every segment and element of society. I changed my mental model away from their socialist mental prison, and now accept people and things as they are. “I am now thankfully free of the woke nightmare. I am not a cultural Marxist communist, and I do not condone the ‘cancel culture’ and soviet-style censorship of shutting down free speech that is so prevalent of these so-called ‘progressive inclusive socialists’ in the West.” Due to waking up from his woke nightmare prison, the man is now a pariah in his society and no longer has a job, has lost all his friends, and is now a complete outcast — a happy outcast.
2;COVID-19 Coronavirus is Biphasic Like Anthrax – Contracted Multiple Times;A Japanese tour operator has caught the COVID-19 virus twice, and there have been other reports of multiple infections on individuals in China. Instead of creating immunity, the virus can reportedly reinfect an individual and hasten fatal heart failure. Even if an infected patient recovers, the virus has two phases, therefore triggers still exist in the victim’s body and can awaken again with even more deadly effect.  CHINA – 14% of patients who recovered from coronavirus infection test positive again. This means they are let go, to contaminate further.  The implications for the spread of the virus are horrific because this means the body’s immune system somehow does not create immunity to COVID-19 once recovered.  This highly contagious airborne virus is now spreading fast across the globe.  As of today, the virus has reached every continent in the world, and still the infected are travelling via air traffic spreading COVID-19 on a constant basis. The virus stays dormant for a period of 28 days in some individuals, and during this period it is highly contagious, even though the carrier may not show any visible symptoms.  Much of the data from China cannot be trusted and it is feared the death toll is way above the amount they have reported, as is the same now ravaging Iran.  Even if a vaccine is created in 12-18 months, this will not stop the rapid spread of the virus.  The vaccine creation would involve finding a viral sequence that would reliably cause a protective immune-system memory but not trigger an acute inflammatory response that would itself cause symptoms. Thankfully, the Israelis are on it and are getting close to a vaccine.
3;The Age of Reason: How Coronavirus Could Save Planet Earth;“Every day, every hour, Chinese people who may or may not be infected with coronavirus COVID-19 are travelling across the world, visiting cities, flying through airports. In turn, those they infect go to their communities and travel, spreading the virus exponentially. This has been happening since the start of the Wuhan outbreak in late December. This is why initial outbreaks are starting to appear in many major cities across Europe right now, and other parts of the world. “Coronavirus, if it does its job properly could be the saviour of planet earth, and in turn save humanity in the long run if the population is reduced by 90% and kept at a sustainable level. “It may take some time, and the virus may mutate, disappear for a short period before reappearing again. There may be many waves of the virus over decades until an acceptable human population level is met. “The EU must keep the Schengen free travel zone open, global air traffic must continue, and the shopping malls and mass congregation of people must be allowed to continue. “We must leave room for nature, let nature flourish once again, let it breathe again, we must allow what needs to be done to be done, to cleanse the environment and purge the seas of the plastic. “Humanity must be maintained at levels below 500,000,000 in perpetual balance with nature, and the future world governing body must guide reproduction wisely once the cycle is completed. “The old religions must be replaced with tempered reason and science, and we must unite humanity with a living new language. “The new system that will eventually emerge must protect people and nations with fair laws and just courts, avoiding petty laws and useless officials. All nations must work to resolve external disputes in a world court. We must balance personal rights with social duties, and be responsible for the future generations that will come after us. “Above all we must prize beauty, knowledge and love, seeking harmony with the infinite.”